pilot_item_id,sentence_marked,sentence,head_form,head_children,participial_form,licensing_marker,constructional_environment,local_subject_present,by_pp_present,stranded_preposition,event_implied,agent_implied,predicand_as_undergoer,peripheral_subtype,family_status,notes,pilot_order
FS002,"When Iraq invaded Kuwait , many of these girls were transported to Jordan and then smuggled to various countries -- Germany , France , Canada , Denmark , England , the United States -- where they were [[raised]] by guardians who were usually Mujahedeen supporters .","When Iraq invaded Kuwait, many of these girls were transported to Jordan and then smuggled to various countries -- Germany, France, Canada, Denmark, England, the United States -- where they were raised by guardians who were usually Mujahedeen supporters.",raised,34:punct:--;35:advmod:where;36:nsubj:pass:they;37:aux:pass:were;40:obl:agent:guardians,,,,,,,,,,,,,1
FS003,A resubstantiation of the full Q1 DPR will be [[completed]] by the Risk control staff reconciling the full trial balances between Q1 open and Q1 close,A resubstantiation of the full Q1 DPR will be completed by the Risk control staff reconciling the full trial balances between Q1 open and Q1 close,completed,2:nsubj:pass:resubstantiation;8:aux:will;9:aux:pass:be;15:obl:agent:staff;16:advcl:reconciling,,,,,,,,,,,,,2
FS005,"Japan 's special envoy , Yasushi Akashi , who called for tangible progress in the peace process before the money would be [[released]] , came back from visits to Colombo and Kilinochchi in early November a frustrated man .","Japan's special envoy, Yasushi Akashi, who called for tangible progress in the peace process before the money would be released, came back from visits to Colombo and Kilinochchi in early November a frustrated man.",released,18:mark:before;20:nsubj:pass:money;21:aux:would;22:aux:pass:be,,,,,,,,,,,,,3
FS001,"The Gulf itself only has one exit , the Strait of Hormuz , which is also [[dominated]] by the mountainous Iranian coastline .","The Gulf itself only has one exit, the Strait of Hormuz, which is also dominated by the mountainous Iranian coastline.",dominated,"13:punct:,;14:nsubj:pass:which;15:aux:pass:is;16:advmod:also;22:obl:agent:coastline",,,,,,,,,,,,,4
FS004,"The Lunar Transporatation Systems ( LTS ) is actually being [[funded]] by two space businessmen , Walter Kistler and Bob Citron .","The Lunar Transporatation Systems (LTS) is actually being funded by two space businessmen, Walter Kistler and Bob Citron.",funded,4:nsubj:pass:Systems;8:aux:is;9:advmod:actually;10:aux:pass:being;15:obl:agent:businessmen;22:punct:.,,,,,,,,,,,,,5
FS006,"Thus , the sound of the word dog in English is connected to the concept ‘ dog ’ by historical accident and not by any natural connection ; roughly the same concept is just as well [[denoted]] in French by chien , in German by hund , and in Japanese by inu .","Thus, the sound of the word dog in English is connected to the concept ‘dog’ by historical accident and not by any natural connection; roughly the same concept is just as well denoted in French by chien, in German by hund, and in Japanese by inu.",denoted,28:punct:;;32:nsubj:pass:concept;33:aux:pass:is;36:advmod:well;39:obl:French;41:obl:agent:chien;44:conj:German;50:conj:Japanese,,,,,,,,,,,,,6
